{
  "id": "longsword_01",
  "name": "Longsword +1",
  "type": "weapon",
  "description": "A finely crafted steel blade with faint magical runes etched along its length.",
  "weight": 4.0,
  "value": {
    "gold": 500,
    "silver": 0,
    "copper": 0
  },
  "magical": true,
  "bonus": 1,
  "damage": "1d8+1",
  "effects": [
    "Glows faintly in the presence of orcs"
  ]
}
